{
  "schemaVersion": "format-profile-evaluator-report.v0",
  "caseId": "docx-policy",
  "verdict": "not_run",
  "ruleResults": [],
  "metrics": {
    "qualityScore": 0
  },
  "diagnostics": [
    {
      "severity": "error",
      "code": "llm_disabled",
      "message": "LLM refinement disabled by mode."
    }
  ]
}
